{
  "name": "recommendation-strength-review",
  "kind": "analysis",
  "audiences": [],
  "scope": {
    "tiers": [],
    "levels": [
      1,
      2,
      3,
      4
    ],
    "tags": []
  },
  "requires": [
    "workspace",
    "register"
  ],
  "optional_inputs": [
    "nine-m-map"
  ],
  "produces": {
    "pack": "recommendation-strength-review",
    "files": []
  },
  "formats": [
    "docx"
  ],
  "share_default": "internal",
  "embed_default": "cited",
  "interactive": false,
  "since": "2.0.0",
  "questions": []
}
