{
  "name": "report-comparison",
  "kind": "analysis",
  "audiences": [],
  "scope": {
    "tiers": [],
    "levels": [],
    "tags": []
  },
  "requires": [
    "workspace"
  ],
  "optional_inputs": [
    "register",
    "comparator"
  ],
  "produces": {
    "pack": "report-comparison",
    "files": [
      "workspace/comparator.json",
      "workspace/comparison-map.json",
      "outputs/report-comparison-client-safe.json",
      "outputs/report-comparison-regulator-safe.json"
    ]
  },
  "formats": [
    "docx"
  ],
  "share_default": "internal",
  "embed_default": "cited",
  "interactive": false,
  "since": "0.1.0",
  "questions": [
    "Which official or other report is being compared?"
  ]
}
