{
  "name": "precursor-timeline",
  "kind": "analysis",
  "audiences": [],
  "scope": {
    "tiers": [],
    "levels": [],
    "tags": []
  },
  "requires": [
    "workspace",
    "timeline"
  ],
  "optional_inputs": [
    "register"
  ],
  "produces": {
    "pack": "precursor-timeline",
    "files": []
  },
  "share_default": "internal",
  "embed_default": "cited",
  "interactive": false,
  "since": "0.1.0",
  "questions": []
}
