{
  "name": "supervisor-coach",
  "kind": "audience",
  "audiences": [
    "supervisors"
  ],
  "scope": {
    "tiers": [
      "T2"
    ],
    "levels": [],
    "tags": []
  },
  "requires": [
    "workspace",
    "clusters"
  ],
  "optional_inputs": [
    "register",
    "adoption"
  ],
  "produces": {
    "pack": "supervisor-coach",
    "files": []
  },
  "share_default": "internal",
  "embed_default": "cited",
  "interactive": false,
  "since": "0.1.0",
  "questions": []
}
